{
  "schema_version": "jury.verdict.v1",
  "id": "verdict_fixture_accept",
  "claim_id": "claim_fixture_accept",
  "claim_version": 1,
  "decision": "accept",
  "reason": "Required evidence passed and no blocking objections remain open.",
  "next_actions": [],
  "evidence_ids": ["ev_fixture_passed"],
  "objection_ids": [],
  "waiver_ids": [],
  "decided_by": "judge:fixture",
  "decided_at": "2026-05-23T00:00:00.000Z"
}
